{"$schema":"https://json-schema.org/draft/2020-12/schema","$id":"https://anomaly.local/gmcp-contract/1.1.0/Anomaly.Char.Status.json","title":"Anomaly.Char.Status","description":"Snapshot. target follows A.7 (\"someone\" when the target is not visible to the receiver).","x-direction":"s2c","x-frozen":false,"type":"object","properties":{"combat":{"type":"boolean"},"target":{"type":["string","null"]},"resting":{"type":"boolean"},"meditating":{"type":"boolean"},"sneaking":{"type":"boolean"},"hidden":{"type":"boolean"},"blind":{"type":"boolean"},"poisoned":{"type":"boolean"},"diseased":{"type":"boolean"},"held":{"type":"boolean"},"confused":{"type":"boolean"},"encumbrance":{"type":"object","properties":{"percent":{"type":"integer","minimum":0},"band":{"enum":["none","light","medium","heavy"]}},"required":["percent","band"],"additionalProperties":false},"light":{"type":"object","properties":{"carried":{"type":["string","null"]},"roundsLeft":{"type":["integer","null"]}},"required":["carried","roundsLeft"],"additionalProperties":false},"alignment":{"type":"string"},"evilPoints":{"type":"integer"}},"required":["combat","target","resting","meditating","sneaking","hidden","blind","poisoned","diseased","held","confused","encumbrance","light","alignment","evilPoints"],"additionalProperties":false}
