{"combat":false,"target":null,"resting":false,"meditating":false,"sneaking":false,"hidden":false,"blind":false,"poisoned":false,"diseased":false,"held":false,"confused":false,"encumbrance":{"percent":31,"band":"light"},"light":{"carried":"torch","roundsLeft":240},"alignment":"Neutral","evilPoints":0}
